{
  "$schema": "https://json-schema.org/draft/2020-12/schema",
  "$id": "https://hm-ai-fuzz.local/schema/pipeline.schema.json",
  "title": "hm-ai-fuzz Full Pipeline Output",
  "type": "object",
  "additionalProperties": false,
  "required": [
    "discover",
    "diff",
    "generate",
    "validate"
  ],
  "properties": {
    "discover": {
      "$ref": "./discover.schema.json"
    },
    "diff": {
      "$ref": "./diff.schema.json"
    },
    "generate": {
      "$ref": "./generate.schema.json"
    },
    "validate": {
      "$ref": "./validate.schema.json"
    }
  }
}
