{
  "discover": [
    {
      "subsystem": "proc",
      "target": "/proc/consoles",
      "kind": "virtual_file",
      "capabilities": [
        "open",
        "read"
      ],
      "source": {
        "file": "fs/proc/consoles.c",
        "line": 113,
        "symbol": "consoles_op"
      },
      "metadata": {
        "target_module": "fs/proc",
        "search_method": "prefix",
        "scan_mode": "auto",
        "node_type": "file",
        "module_file": "fs/proc/consoles.c",
        "registration_kind": "proc_create_seq",
        "manual_todo": [
          "ops symbol consoles_op was not resolved",
          "using conservative open/read fallback because ops could not be resolved"
        ],
        "files_scanned": 34,
        "registrations_scanned": 39
      }
    },
    {
      "subsystem": "proc",
      "target": "/proc/mounts",
      "kind": "virtual_symlink",
      "capabilities": [
        "open",
        "read"
      ],
      "source": {
        "file": "fs/proc/root.c",
        "line": 371,
        "symbol": null
      },
      "metadata": {
        "target_module": "fs/proc",
        "search_method": "prefix",
        "scan_mode": "auto",
        "node_type": "symlink",
        "module_file": "fs/proc/root.c",
        "registration_kind": "proc_symlink",
        "manual_todo": [
          "using conservative open/read fallback because ops could not be resolved"
        ],
        "files_scanned": 34,
        "registrations_scanned": 39
      }
    },
    {
      "subsystem": "proc",
      "target": "/proc/fs",
      "kind": "virtual_dir",
      "capabilities": [
        "open",
        "getdents64"
      ],
      "source": {
        "file": "fs/proc/root.c",
        "line": 374,
        "symbol": null
      },
      "metadata": {
        "target_module": "fs/proc",
        "search_method": "prefix",
        "scan_mode": "auto",
        "node_type": "dir",
        "module_file": "fs/proc/root.c",
        "registration_kind": "proc_mkdir",
        "manual_todo": [],
        "files_scanned": 34,
        "registrations_scanned": 39
      }
    },
    {
      "subsystem": "proc",
      "target": "/proc/driver",
      "kind": "virtual_dir",
      "capabilities": [
        "open",
        "getdents64"
      ],
      "source": {
        "file": "fs/proc/root.c",
        "line": 375,
        "symbol": null
      },
      "metadata": {
        "target_module": "fs/proc",
        "search_method": "prefix",
        "scan_mode": "auto",
        "node_type": "dir",
        "module_file": "fs/proc/root.c",
        "registration_kind": "proc_mkdir",
        "manual_todo": [],
        "files_scanned": 34,
        "registrations_scanned": 39
      }
    },
    {
      "subsystem": "proc",
      "target": "/proc/bus",
      "kind": "virtual_dir",
      "capabilities": [
        "open",
        "getdents64"
      ],
      "source": {
        "file": "fs/proc/root.c",
        "line": 382,
        "symbol": null
      },
      "metadata": {
        "target_module": "fs/proc",
        "search_method": "prefix",
        "scan_mode": "auto",
        "node_type": "dir",
        "module_file": "fs/proc/root.c",
        "registration_kind": "proc_mkdir",
        "manual_todo": [],
        "files_scanned": 34,
        "registrations_scanned": 39
      }
    },
    {
      "subsystem": "proc",
      "target": "/proc/sys",
      "kind": "virtual_dir",
      "capabilities": [
        "open",
        "getdents64"
      ],
      "source": {
        "file": "fs/proc/proc_sysctl.c",
        "line": 1565,
        "symbol": null
      },
      "metadata": {
        "target_module": "fs/proc",
        "search_method": "prefix",
        "scan_mode": "auto",
        "node_type": "dir",
        "module_file": "fs/proc/proc_sysctl.c",
        "registration_kind": "proc_mkdir",
        "manual_todo": [],
        "files_scanned": 34,
        "registrations_scanned": 39
      }
    },
    {
      "subsystem": "proc",
      "target": "/proc/stat",
      "kind": "virtual_file",
      "capabilities": [
        "open",
        "lseek",
        "read"
      ],
      "source": {
        "file": "fs/proc/stat.c",
        "line": 213,
        "symbol": "stat_proc_ops"
      },
      "metadata": {
        "target_module": "fs/proc",
        "search_method": "prefix",
        "scan_mode": "auto",
        "node_type": "file",
        "module_file": "fs/proc/stat.c",
        "registration_kind": "proc_create",
        "manual_todo": [],
        "files_scanned": 34,
        "registrations_scanned": 39
      }
    },
    {
      "subsystem": "proc",
      "target": "/proc/maps",
      "kind": "virtual_file",
      "capabilities": [
        "open",
        "read"
      ],
      "source": {
        "file": "fs/proc/nommu.c",
        "line": 112,
        "symbol": "proc_nommu_region_list_seqop"
      },
      "metadata": {
        "target_module": "fs/proc",
        "search_method": "prefix",
        "scan_mode": "auto",
        "node_type": "file",
        "module_file": "fs/proc/nommu.c",
        "registration_kind": "proc_create_seq",
        "manual_todo": [
          "ops symbol proc_nommu_region_list_seqop was not resolved",
          "using conservative open/read fallback because ops could not be resolved"
        ],
        "files_scanned": 34,
        "registrations_scanned": 39
      }
    },
    {
      "subsystem": "proc",
      "target": "/proc/loadavg",
      "kind": "virtual_file",
      "capabilities": [
        "open",
        "read"
      ],
      "source": {
        "file": "fs/proc/loadavg.c",
        "line": 33,
        "symbol": null
      },
      "metadata": {
        "target_module": "fs/proc",
        "search_method": "prefix",
        "scan_mode": "auto",
        "node_type": "file",
        "module_file": "fs/proc/loadavg.c",
        "registration_kind": "proc_create_single",
        "manual_todo": [
          "using conservative open/read fallback because ops could not be resolved"
        ],
        "files_scanned": 34,
        "registrations_scanned": 39
      }
    },
    {
      "subsystem": "proc",
      "target": "/proc/bootconfig",
      "kind": "virtual_file",
      "capabilities": [
        "open",
        "read"
      ],
      "source": {
        "file": "fs/proc/bootconfig.c",
        "line": 98,
        "symbol": null
      },
      "metadata": {
        "target_module": "fs/proc",
        "search_method": "prefix",
        "scan_mode": "auto",
        "node_type": "file",
        "module_file": "fs/proc/bootconfig.c",
        "registration_kind": "proc_create_single",
        "manual_todo": [
          "using conservative open/read fallback because ops could not be resolved"
        ],
        "files_scanned": 34,
        "registrations_scanned": 39
      }
    },
    {
      "subsystem": "proc",
      "target": "/proc/cpuinfo",
      "kind": "virtual_file",
      "capabilities": [
        "open",
        "lseek",
        "read"
      ],
      "source": {
        "file": "fs/proc/cpuinfo.c",
        "line": 25,
        "symbol": "cpuinfo_proc_ops"
      },
      "metadata": {
        "target_module": "fs/proc",
        "search_method": "prefix",
        "scan_mode": "auto",
        "node_type": "file",
        "module_file": "fs/proc/cpuinfo.c",
        "registration_kind": "proc_create",
        "manual_todo": [],
        "files_scanned": 34,
        "registrations_scanned": 39
      }
    },
    {
      "subsystem": "proc",
      "target": "/proc/kmsg",
      "kind": "virtual_file",
      "capabilities": [
        "read",
        "poll",
        "open",
        "lseek"
      ],
      "source": {
        "file": "fs/proc/kmsg.c",
        "line": 60,
        "symbol": "kmsg_proc_ops"
      },
      "metadata": {
        "target_module": "fs/proc",
        "search_method": "prefix",
        "scan_mode": "auto",
        "node_type": "file",
        "module_file": "fs/proc/kmsg.c",
        "registration_kind": "proc_create",
        "manual_todo": [],
        "files_scanned": 34,
        "registrations_scanned": 39
      }
    },
    {
      "subsystem": "proc",
      "target": "/proc/softirqs",
      "kind": "virtual_file",
      "capabilities": [
        "open",
        "read"
      ],
      "source": {
        "file": "fs/proc/softirqs.c",
        "line": 33,
        "symbol": null
      },
      "metadata": {
        "target_module": "fs/proc",
        "search_method": "prefix",
        "scan_mode": "auto",
        "node_type": "file",
        "module_file": "fs/proc/softirqs.c",
        "registration_kind": "proc_create_single",
        "manual_todo": [
          "using conservative open/read fallback because ops could not be resolved"
        ],
        "files_scanned": 34,
        "registrations_scanned": 39
      }
    },
    {
      "subsystem": "proc",
      "target": "/proc/devices",
      "kind": "virtual_file",
      "capabilities": [
        "open",
        "read"
      ],
      "source": {
        "file": "fs/proc/devices.c",
        "line": 60,
        "symbol": "devinfo_ops"
      },
      "metadata": {
        "target_module": "fs/proc",
        "search_method": "prefix",
        "scan_mode": "auto",
        "node_type": "file",
        "module_file": "fs/proc/devices.c",
        "registration_kind": "proc_create_seq",
        "manual_todo": [
          "ops symbol devinfo_ops was not resolved",
          "using conservative open/read fallback because ops could not be resolved"
        ],
        "files_scanned": 34,
        "registrations_scanned": 39
      }
    },
    {
      "subsystem": "proc",
      "target": "/proc/interrupts",
      "kind": "virtual_file",
      "capabilities": [
        "open",
        "read"
      ],
      "source": {
        "file": "fs/proc/interrupts.c",
        "line": 39,
        "symbol": "int_seq_ops"
      },
      "metadata": {
        "target_module": "fs/proc",
        "search_method": "prefix",
        "scan_mode": "auto",
        "node_type": "file",